{
  "schema": "inside-valdivia.h3-workflow-spec/1",
  "id": "W4",
  "version": 3,
  "name": "H3 native AV span continuation",
  "implementation_class": "official-h3-with-cauce-primitives",
  "operation": "Extend a cumulative H3 AV latent by planning a globally aligned target, conditioning it with an extracted native AV span, and appending only an explicit generated suffix.",
  "input_contract": [
    { "name": "source_native_av_latent", "type": "LATENT", "required": true, "cardinality": "one packed cumulative H3 AV latent" },
    { "name": "prompt", "type": "STRING", "required": true },
    { "name": "overlap_frames", "type": "INT", "required": true },
    { "name": "extension_frames", "type": "INT", "required": true },
    { "name": "seed", "type": "INT", "required": true }
  ],
  "output_contract": [
    { "name": "continued_native_av_latent", "type": "LATENT", "required": true, "cardinality": "source plus one globally contiguous AV span" },
    { "name": "generated_suffix", "type": "CAUCE_H3_AV_SPAN", "required": true },
    { "name": "continued_frames", "type": "IMAGE", "required": false, "cardinality": "decoded cumulative latent" }
  ],
  "constraints": {
    "frame_rate": 24,
    "frame_count_rule": "17k+5",
    "characterized_overlap_frames": 22,
    "characterized_extension_frames": 119,
    "characterized_window_frames": 141,
    "absolute_audio_clock_hz": 40,
    "fixed_soundtrack_conditioning": false,
    "sampler_patch": false
  },
  "graph_contract": [
    { "order": 1, "owner": "cauce", "node_type": "CauceH3InspectAVLatent", "role": "validate the cumulative packed AV latent and expose its exact frame/token geometry" },
    { "order": 2, "owner": "cauce", "node_type": "CauceH3PlanAVWindow", "role": "resolve the absolute overlap and extension boundaries on both H3 clocks" },
    { "order": 3, "owner": "cauce", "node_type": "CauceH3AllocateAVWindow", "role": "allocate the fresh globally aligned AV target used by the sampler" },
    { "order": 4, "owner": "cauce", "node_type": "CauceH3ExtractAVSpan", "role": "extract the synchronized native tail span from the cumulative source" },
    { "order": 5, "owner": "official-comfy", "node_type": "MiniMaxH3ImageToVideo", "role": "create prompt conditioning for exactly the planned window length; its empty latent output is not used" },
    { "order": 6, "owner": "cauce", "node_type": "CauceH3AddAVSpanGuide", "role": "insert the extracted AV span at frame zero on the active positive-conditioning edge" },
    { "order": 7, "owner": "official-comfy", "node_type": "MiniMaxH3SigmaShift", "role": "set explicit video and structural-audio flow shifts" },
    { "order": 8, "owner": "vanilla-comfy", "node_type": null, "role": "sample the allocated continuation window with explicit guider, sampler, scheduler, seed, and steps" },
    { "order": 9, "owner": "cauce", "node_type": "CauceH3ExtractAVSpan", "role": "extract only the explicit new suffix from the sampled window using its nonzero timeline origin" },
    { "order": 10, "owner": "cauce", "node_type": "CauceH3AppendAVSpan", "role": "append the globally contiguous suffix without a hidden transition policy" }
  ],
  "variants": [
    { "id": "characterized-layout", "overlap_frames": 22, "extension_frames": 119, "window_frames": 141 },
    { "id": "overlap-ablation", "change_one_variable": "overlap_frames" },
    { "id": "extension-ablation", "change_one_variable": "extension_frames" }
  ],
  "evidence": {
    "deterministic_layer": "CAUCE 3.0 AV layout/span/append operations unit-validated with synthetic packed tensors",
    "model_layer": "live schema and a synthetic one-step continuation smoke execute on CAUCE 3.0; production-resolution visual evaluation remains pending"
  }
}
